{
    "input_image": "https://files.catbox.moe/kxihm6.jpg",
    "style_image1": "https://files.catbox.moe/bdzw7s.png",
    "style_image2": "https://files.catbox.moe/59u8q5.png",
    "style_image3": "https://files.catbox.moe/ctpfk2.png",
    "style_image4": "https://files.catbox.moe/gjy7lc.png",
    "enable_image_caption": true,
    "caption_type": "Booru tag list",
    "caption_length": "short",
    "low_vram": true,
    "positive_prompt": "solo, simple_background, white_background, monochrome, no_humans, robot, mecha, science_fiction",
    "negative_prompt": "blurry",
    "seed": 0,
    "steps": 20,
    "cfg": 5.3,
    "sampler_name": "dpmpp_sde",
    "scheduler": "karras",
    "width": 1024,
    "height": 1024
}